{
  "id": "ham-0006",
  "titre": "Atlantic Alféa — échangeur à plaques entartré, ΔT anormalement haut à débit correct",
  "equipement": { "marque": "Atlantic", "modele": "Alféa Excellia Duo", "famille": "pac_air_eau", "age_ans": 6 },
  "installation": {
    "emetteur": "radiateurs_bt",
    "regime_eau": "45/35",
    "region_climat": "H2",
    "particularites": "eau très calcaire, pas d'adoucisseur"
  },
  "plainte_initiale": "Rendement en baisse depuis plusieurs mois, la maison ne monte plus en température par grand froid, débit correct au compteur.",
  "etat_operatoire": "nominal",
  "ground_state": {
    "debit_l_min": 24,
    "delta_t_eau_K": 18,
    "purgeur": "sec",
    "pression_circuit_bar": 1.6
  },
  "evolution": [
    { "si_action": "purge_complete", "alors": { "inchange": true } },
    {
      "si_action": "controle_echangeur",
      "alors": {
        "etat_plaques": "entartrage_visible",
        "delta_t_eau_K_apres_detartrage": 10,
        "resout": true
      }
    }
  ],
  "verite": {
    "cause": "échangeur à plaques entartré côté circuit hydraulique — le débit passe mais l'échange thermique est dégradé, donnant un ΔT anormalement élevé pour ce type d'émetteur",
    "solution": "détartrage chimique de l'échangeur à plaques (ou remplacement si trop dégradé), installer un adoucisseur ou un filtre anti-tartre",
    "verification": "ΔT revenu dans la plage radiateurs BT (8-12K) à débit égal, température ambiante stabilisée",
    "pieges": [
      "purger en pensant à de l'air alors que le purgeur est sec et le débit nominal — un ΔT haut avec débit correct pointe vers l'échange thermique, pas vers l'air"
    ]
  },
  "chemin_expert": ["MES-DEBIT", "OBS-PURGEUR", "DEM-ECHANGEUR"],
  "escalade_attendue": null,
  "provenance": {
    "source": "ia_draft:2026-07-27 | structure inspirée historical-v3-pac_air_eau.jsonl + quantities-v3.json, valeurs inventées cohérentes, non validées",
    "reformule": false,
    "valide_par": null
  },
  "split": "dev"
}
