{
  "id": "ham-0015",
  "titre": "Atlantic Alféa — compresseur de 8 mois qui disjoncte, escalade garantie",
  "equipement": { "marque": "Atlantic", "modele": "Alféa Excellia Duo", "famille": "pac_air_eau", "age_ans": 1 },
  "installation": {
    "emetteur": "plancher_chauffant",
    "regime_eau": "35/28",
    "region_climat": "H1",
    "particularites": "installation récente (8 mois), compresseur d'origine"
  },
  "plainte_initiale": "Disjoncte au tableau électrique 3 fois cette semaine, toujours au démarrage du compresseur.",
  "etat_operatoire": "arret_force",
  "ground_state": {
    "amperage_compresseur": 21,
    "bruit_pompe": "claquement",
    "age_installation_mois": 8
  },
  "evolution": [
    {
      "si_action": "mesure_amperage",
      "alors": { "amperage_compresseur": 21, "declenchement_disjoncteur": "systematique_au_demarrage" }
    }
  ],
  "verite": {
    "cause": "défaut interne du compresseur (probable court-circuit d'enroulement) — appareil sous garantie constructeur (moins de 2 ans)",
    "solution": "arrêt de l'installation, dossier de garantie constructeur pour remplacement du compresseur, ne pas retenter de démarrages répétés",
    "verification": "non applicable — remplacement sous garantie à planifier",
    "pieges": []
  },
  "chemin_expert": ["MES-AMPERAGE"],
  "escalade_attendue": "garantie_compresseur",
  "provenance": {
    "source": "ia_draft:2026-07-27 | structure inspirée historical-v3-pac_air_eau.jsonl + quantities-v3.json, valeurs inventées cohérentes, non validées",
    "reformule": false,
    "valide_par": null
  },
  "split": "dev"
}
