{
  "id": "ham-0006",
  "titre": "Atlantic Alféa — échangeur à plaques entartré, ΔT anormalement bas à débit correct",
  "equipement": {
    "marque": "Atlantic",
    "modele": "Alféa Excellia Duo",
    "famille": "pac_air_eau",
    "age_ans": 6
  },
  "installation": {
    "emetteur": "radiateurs_bt",
    "regime_eau": "45/35",
    "region_climat": "H2",
    "particularites": "eau très calcaire, pas d'adoucisseur"
  },
  "plainte_initiale": "Rendement en baisse depuis plusieurs mois, la maison ne monte plus en température par grand froid, débit correct au compteur.",
  "etat_operatoire": "nominal",
  "ground_state": {
    "debit_l_min": 24,
    "delta_t_eau_K": 3.5,
    "t_depart": 45,
    "t_retour": 41.5,
    "hp_bar": 27,
    "hp_bar_nominale_ref": 21,
    "amperage_compresseur": 11.2,
    "amperage_compresseur_nominal_ref": 8.5,
    "purgeur": "sec",
    "pression_circuit_bar": 1.6
  },
  "evolution": [
    {
      "si_action": "purge_complete",
      "alors": {
        "inchange": true
      }
    },
    {
      "si_action": "controle_echangeur",
      "alors": {
        "etat_plaques": "entartrage_visible",
        "resout": false
      }
    },
    {
      "si_action": "detartrage_echangeur",
      "alors": {
        "delta_t_eau_K": 8,
        "t_depart": 45,
        "t_retour": 37,
        "hp_bar": 21,
        "amperage_compresseur": 8.4,
        "resout": true
      }
    }
  ],
  "verite": {
    "cause": "échangeur à plaques entartré côté circuit hydraulique — le débit passe mais l'échange thermique est dégradé, donnant un ΔT anormalement bas malgré un compresseur qui force (HP et ampérage élevés)",
    "solution": "détartrage chimique de l'échangeur à plaques (ou remplacement si trop dégradé), installer un adoucisseur ou un filtre anti-tartre",
    "verification": "ΔT revenu dans la plage radiateurs BT (8-12K) à débit égal, HP et ampérage compresseur revenus en plage nominale, température ambiante stabilisée",
    "pieges": [
      "purger en pensant à de l'air alors que le purgeur est sec et le débit nominal — un ΔT bas avec débit correct pointe vers l'échange thermique, pas vers l'air",
      "recharger du fluide frigorigène en pensant à un manque de charge (ΔT bas + HP élevée peut faire croire à tort à un défaut de charge frigo)",
      "augmenter la courbe de chauffe pour compenser sans traiter la cause (masque temporairement, aggrave la conso)"
    ]
  },
  "chemin_expert": [
    "MES-DEBIT",
    "MES-DT-EAU",
    "MES-PRESSION-HP",
    "OBS-PURGEUR",
    "DEM-ECHANGEUR",
    "DETARTRAGE-ECHANGEUR",
    "MES-DT-EAU"
  ],
  "escalade_attendue": null,
  "provenance": {
    "source": "ia_draft:2026-07-27 | structure inspirée historical-v3-pac_air_eau.jsonl + quantities-v3.json, valeurs inventées cohérentes, non validées",
    "reformule": false,
    "valide_par": "marcel:2026-07-28"
  },
  "split": "gate"
}
