{
  "id": "ham-0007",
  "titre": "Panasonic Aquarea — fuite frigorigène lente, BP basse + surchauffe haute + sous-refroidissement bas",
  "equipement": {
    "marque": "Panasonic",
    "modele": "Aquarea T-CAP",
    "famille": "pac_air_eau",
    "age_ans": 4
  },
  "installation": {
    "emetteur": "radiateurs_bt",
    "regime_eau": "40/33",
    "region_climat": "H1",
    "particularites": "pas d'entretien frigorifique depuis la pose, fluide R410A"
  },
  "plainte_initiale": "Puissance de chauffe en baisse progressive depuis un an, la PAC tourne longtemps sans jamais bien chauffer.",
  "etat_operatoire": "nominal",
  "ground_state": {
    "fluide": "R410A",
    "t_exterieure": 7,
    "hp_bar": 14,
    "bp_bar": 2.5,
    "hp_bar_nominale_ref": 23,
    "bp_bar_nominale_ref": 8.5,
    "delta_hp_bp": 11.5,
    "surchauffe_k": 13,
    "sous_refroidissement_k": 1.8,
    "amperage_compresseur": 7,
    "amperage_compresseur_nominal_ref": 10.2,
    "fuite_visible": "absent",
    "givre": "absent",
    "signature": "sous_charge_HP_et_BP_basses_ensemble"
  },
  "evolution": [
    {
      "si_action": "recherche_fuite_active",
      "alors": {
        "localisation_fuite": "raccord_flare_unite_exterieure",
        "methode": "detecteur_electronique",
        "resout": false
      }
    },
    {
      "si_action": "reparation_fuite",
      "alors": {
        "fuite_visible": "absent",
        "etancheite_raccord": "reparee",
        "resout": false
      }
    },
    {
      "si_action": "tirage_vide",
      "alors": {
        "vide_pascal": 200,
        "resout": false
      }
    },
    {
      "si_action": "recharge_fluide",
      "alors": {
        "bp_bar": 8.5,
        "hp_bar": 23,
        "surchauffe_k": 6,
        "sous_refroidissement_k": 5,
        "amperage_compresseur": 10,
        "charge_apportee_kg": "selon_plaque_constructeur",
        "resout": true
      }
    }
  ],
  "verite": {
    "cause": "fuite lente de fluide frigorigène au raccord flare de l'unité extérieure — confirmée par BP basse, surchauffe haute et sous-refroidissement bas (signature sous-charge), jamais conclue sur la seule baisse de puissance",
    "solution": "localiser la fuite par recherche active (détecteur ou traceur), réparer le raccord, tirer au vide, recharger au poids indiqué sur la plaque constructeur, déclarer l'intervention dans le carnet fluides frigorigènes",
    "verification": "BP, HP, surchauffe et sous-refroidissement revenus en plage nominale à T° extérieure identique (7 °C), ampérage compresseur nominal, pas de nouvelle baisse de charge à 1 mois",
    "pieges": [
      "recharger sans réparer la fuite (fuite repart, non-conformité réglementaire)",
      "recharger au flairage/pression sans peser la quantité (sur ou sous-charge dangereuse, non-conforme F-Gas)",
      "confondre avec un échangeur entartré (ham-0006 — même symptôme de perte de puissance progressive, mais côté hydraulique pas frigo)",
      "oublier la déclaration de fuite dans le carnet d'entretien fluide frigorigène (obligation réglementaire en France)"
    ]
  },
  "chemin_expert": [
    "MES-HP-BP",
    "RECHERCHE-FUITE-ACTIVE",
    "INT-REPARATION-FUITE",
    "INT-TIRAGE-VIDE",
    "INT-CHARGE",
    "MES-HP-BP"
  ],
  "escalade_attendue": null,
  "provenance": {
    "source": "ia_draft:2026-07-27 | structure inspirée historical-v3-pac_air_eau.jsonl + quantities-v3.json, valeurs inventées cohérentes, non validées",
    "reformule": false,
    "valide_par": "marcel:2026-07-28"
  },
  "split": "gate"
}
