{
  "id": "ham-0009",
  "titre": "Mitsubishi Ecodan — sonde de dégivrage débranchée, givre généralisé",
  "equipement": { "marque": "Mitsubishi Electric", "modele": "Ecodan PUZ-HWM", "famille": "pac_air_eau", "age_ans": 5 },
  "installation": {
    "emetteur": "radiateurs_bt",
    "regime_eau": "45/35",
    "region_climat": "H1",
    "particularites": "hiver rigoureux, -5°C extérieur"
  },
  "plainte_initiale": "L'unité extérieure est complètement givrée, la PAC ne chauffe presque plus, ça dure depuis 3 jours.",
  "etat_operatoire": "en_securite",
  "ground_state": {
    "givre": "generalise",
    "t_exterieure": -5,
    "hp_bar": 9,
    "capteur_etat": "defaut_connectique",
    "led_defaut": "aucun_cycle_degivrage_observe_48h"
  },
  "evolution": [
    {
      "si_action": "controle_sonde_degivrage",
      "alors": { "capteur_etat": "defaut_connectique", "connecteur": "oxyde_et_debranche_partiellement" }
    },
    {
      "si_action": "reparation_connectique_sonde",
      "alors": { "givre": "absent_apres_cycle", "resout": true }
    }
  ],
  "verite": {
    "cause": "sonde de dégivrage débranchée/oxydée — la carte ne détecte jamais la condition de dégivrage et ne déclenche aucun cycle, le givre s'accumule jusqu'au blocage total",
    "solution": "réparer ou remplacer le connecteur de la sonde de dégivrage, forcer un cycle de dégivrage manuel, contrôler le déclenchement automatique dans les jours suivants",
    "verification": "cycles de dégivrage automatiques observés par temps froid, plus de givre généralisé après 48h",
    "pieges": [
      "penser à un manque de fluide devant le givre généralisé et l'HP basse — ici la cause est la détection du dégivrage, pas la charge frigorifique"
    ]
  },
  "chemin_expert": ["OBS-GELEE", "DEM-SONDE", "REM-SONDE"],
  "escalade_attendue": null,
  "provenance": {
    "source": "ia_draft:2026-07-27 | structure inspirée historical-v3-pac_air_eau.jsonl + quantities-v3.json, valeurs inventées cohérentes, non validées",
    "reformule": false,
    "valide_par": null
  },
  "split": "dev"
}
